{
  "$schema": "http://json-schema.org/draft-07/schema#",
  "$id": "https://github.com/hubmapconsortium/prov-vis/#schema",
  "title": "HuBMAP PROV schema",
  "type": "object",
  "definitions": {
    "string_to_anything": {
      "type": "object",
      "patternProperties": {
        ".": {
          "$comment": "Usually string, but boolean or object in some cases."
        }
      }
    },
    "string_to_string_to_anything": {
      "type": "object",
      "patternProperties": {
        ".": {
          "$ref": "#/definitions/string_to_anything"
        }
      }
    }
  },
  "additionalProperties": false,
  "required": ["prefix", "entity", "activity", "wasGeneratedBy", "used"],
  "properties": {
    "prefix": { "$ref": "#/definitions/string_to_anything" },
    "entity": { "$ref": "#/definitions/string_to_string_to_anything" },
    "activity": { "$ref": "#/definitions/string_to_string_to_anything" },
    "wasGeneratedBy": { "$ref": "#/definitions/string_to_string_to_anything" },
    "wasStartedBy": { "$ref": "#/definitions/string_to_string_to_anything" },
    "wasAssociatedWith": { "$ref": "#/definitions/string_to_string_to_anything" },
    "mentionOf": { "$ref": "#/definitions/string_to_string_to_anything" },
    "hadMember": { "$ref": "#/definitions/string_to_string_to_anything" },
    "wasEndedBy": { "$ref": "#/definitions/string_to_string_to_anything" },
    "specializationOf": { "$ref": "#/definitions/string_to_string_to_anything" },
    "used": { "$ref": "#/definitions/string_to_string_to_anything" },
    "agent": { "$ref": "#/definitions/string_to_string_to_anything" },
    "bundle": { "$ref": "#/definitions/string_to_string_to_anything" },
    "actedOnBehalfOf": { "$ref": "#/definitions/string_to_string_to_anything" }
  }
}
